<?xml version="1.0" encoding="UTF-8"?>
<!DOCTYPE alumnos SYSTEM "alumnos.dtd">
<alumnos>
  <alumno codigo="A001">
    <nombre>Marta</nombre>
    <apellidos>
      <apellido1>Perez</apellido1>
      <apellido2>Clavero</apellido2>
    </apellidos>
    <DNI>1010101O</DNI>
    <fecha_nac>
      <dia>1</dia>
      <mes>enero</mes>
      <año>1997</año>
    </fecha_nac>
    <curso>DAM</curso>
    <nombre_asignatura>
      <asignatura>Programacion</asignatura>
      <nota>8</nota>
    </nombre_asignatura>
  </alumno>
  <alumno codigo="B002">
    <nombre>Diego</nombre>
    <apellidos>
      <apellido1>Perez</apellido1>
      <apellido2>Clavero</apellido2>
    </apellidos>
    <DNI>1010101Z</DNI>
    <fecha_nac>
      <dia>1</dia>
      <mes>enero</mes>
      <año>1997</año>
    </fecha_nac>
    <telefono>123456789</telefono>
    <curso>DAM</curso>
    <nombre_asignatura>
      <asignatura>Programacion</asignatura>
      <nota>8</nota>
    </nombre_asignatura>
  </alumno>
    <alumno codigo="C003">
    <nombre>Pepe</nombre>
    <apellidos>
      <apellido1>Perez</apellido1>
      <apellido2>Clavero</apellido2>
    </apellidos>
    <DNI>1010101G</DNI>
    <fecha_nac>
      <dia>1</dia>
      <mes>enero</mes>
      <año>1997</año>
    </fecha_nac>
    <telefono>123456789</telefono>
    <curso>DAM</curso>
    <nombre_asignatura>
      <asignatura>Programacion</asignatura>
      <nota>8</nota>
    </nombre_asignatura>
        <nombre_asignatura>
      <asignatura>FOL</asignatura>
      <nota>8</nota>
    </nombre_asignatura>
  </alumno>
</alumnos>
