<?xml version="1.0" encoding="UTF-8"?>
<!DOCTYPE alumnos SYSTEM "alumnos.dtd">
<alumnos>
  <alumno codigo="A001">
    <nombre>Marta</nombre>
    <apellidos>
      <apellido1>Perez</apellido1>
      <apellido2>Clavero</apellido2>
    </apellidos>
    <DNI>1010101O</DNI>
    <fecha_nac>
      <dia>1</dia>
      <mes>enero</mes>
      <año>1997</año>
    </fecha_nac>
    <curso nombre="DAW"/>
      <asignatura nombre="L.M." nota="8"/>
      <asignatura nombre="BB.DD." nota="8"/>
  </alumno>
  <alumno codigo="B002">
    <nombre>Diego</nombre>
    <apellidos>
      <apellido1>Perez</apellido1>
      <apellido2>Clavero</apellido2>
    </apellidos>
    <DNI>1010101Z</DNI>
    <fecha_nac>
      <dia>1</dia>
      <mes>enero</mes>
      <año>1997</año>
    </fecha_nac>
    <telefono>123456789</telefono>
    <curso nombre="DAM"/>
      <asignatura nombre="Redes" nota="8"/>
  </alumno>
    <alumno codigo="C003">
    <nombre>Pepe</nombre>
    <apellidos>
      <apellido1>Perez</apellido1>
      <apellido2>Clavero</apellido2>
    </apellidos>
    <DNI>1010101G</DNI>
    <fecha_nac>
      <dia>1</dia>
      <mes>enero</mes>
      <año>1997</año>
    </fecha_nac>
    <telefono>123456789</telefono>
    <curso nombre="DAM"/>
      <asignatura nombre="Redes" nota="8"/>
      <asignatura nombre="L.M." nota="8"/>
  </alumno>
  <alumno codigo="X004">
    <nombre>MARCOS</nombre>
    <apellidos>
      <apellido1>Perez</apellido1>
      <apellido2>Clavero</apellido2>
    </apellidos>
    <DNI>1010101P</DNI>
    <fecha_nac>
      <dia>1</dia>
      <mes>enero</mes>
      <año>1997</año>
    </fecha_nac>
    <telefono>123456782</telefono>
    <curso nombre="DAM"/>
      <asignatura nombre="Redes" nota="8"/>
      <asignatura nombre="L.M." nota="8"/>
      <asignatura nombre="BB.DD." nota="8"/>
  </alumno>
  </alumnos>
